Название продукта,Категория продукта,Цена продукта,Город
Устричный соус высшей категории 148 гр,Бакалея,1 300 Т,Астана
Umami Итальянский Кетчуп с Черным Чесноком 130 гр,Бакалея,4 990 Т,Астана
Umami Итальянский Кремовый Соус из Черного Чеснока 190 гр,Бакалея,10 590 Т,Астана
Umami Итальянский Черный Чеснок Целый 60 гр,Бакалея,4 890 Т,Астана
English Tea Черный чай Harry Potter упаковка 240 шт,Бакалея,13 800 Т,Астана
English Tea Черный чай Harry Potter упаковка 80 шт,Бакалея,8 000 Т,Астана
English Tea Черный чай Union Jack упаковка 100 шт,Бакалея,8 900 Т,Астана
English Tea Черный чай Union Jack упаковка 40 шт,Бакалея,5 500 Т,Астана
English Tea Черный чай в темно зеленой винтажной упаковке 80 шт,Бакалея,8 000 Т,Астана
Carmencita Соль Средиземноморская Йодированная 360 гр,Бакалея,3 500 Т,Астана
СэнСой папричи-соус столовый остро-сладкий 320 гр,Бакалея,1 990 Т,Астана
Сэнсой Соус Тонкацу 350 г,Бакалея,2 500 Т,Астана
Umami Итальянский Черный Чеснок Целый 180 гр,Бакалея,12 800 Т,Астана
English Tea Черный чай без кофеина в голубой винтажной  упаковке 80 шт,Бакалея,8 000 Т,Астана
English Tea Черный чай в лиловой винтажной  упаковке 240 шт,Бакалея,13 800 Т,Астана
English Tea Черный чай в лиловой винтажной  упаковке 80 шт,Бакалея,8 000 Т,Астана
English Tea Черный чай в розовой винтажной  упаковке 240 шт,Бакалея,13 800 Т,Астана
English Tea Черный чай в фиолетовой винтажной  упаковке 240 шт,Бакалея,13 800 Т,Астана
"Джем инжирный Le Bonta, 314 мл","Снэки, сладости",3 500 Т,Астана
Миндальная паста Alicos 190 гр,"Снэки, сладости",3 500 Т,Астана
Bonne Maman Джем клубничный 370 мл,"Снэки, сладости",2 600 Т,Астана
Bonne Maman Джем абрикосовый 370 мл,"Снэки, сладости",2 600 Т,Астана
Джем из красного Сицилийского апельсина Alicos 110 гр,"Снэки, сладости",2 500 Т,Астана
Bonne Maman Паста арахисовая 325 мл,"Снэки, сладости",2 600 Т,Астана
Bonne Maman Джем черничный 370 мл,"Снэки, сладости",2 600 Т,Астана
Bonne Maman Мармелад апельсиновый 370 мл,"Снэки, сладости",2 600 Т,Астана
Plaza Del Sol Картофельные чипсы с черным трюфелем 115 гр,"Снэки, сладости",1 600 Т,Астана
Bonne Maman Паста шоколадная с фундуком 250 гр,"Снэки, сладости",2 600 Т,Астана
Картофельные Чипсы Белый трюфель 150 гр,"Снэки, сладости",4 500 Т,Астана
Bonne Maman Джем малиновый 370 мл,"Снэки, сладости",2 600 Т,Астана
Картофельные чипсы с Чили перцем ж/б 40 гр,"Снэки, сладости",1 200 Т,Астана
Plaza Del Sol Картофельные чипсы с сыром 115 гр,"Снэки, сладости",1 600 Т,Астана
Plaza Del Sol Картофельные чипсы с хамоном 115 гр,"Снэки, сладости",1 600 Т,Астана
Джем грушевый Le Bonta 314 мл,"Снэки, сладости",3 000 Т,Астана
Deseo Кантучини Тосканские с миндалем 250 гр,"Снэки, сладости",3 900 Т,Астана
"Джем из Сицилийского Лимона, 110 гр","Снэки, сладости",2 500 Т,Астана
Картофельные Чипсы Белый Трюфель и Белый Гриб 150 гр,"Снэки, сладости",4 500 Т,Астана
Bonne Maman Джем фруктовое ассорти 370 мл,"Снэки, сладости",2 600 Т,Астана
Джем из Красного сицилийского апельсина 220 гр,"Снэки, сладости",3 500 Т,Астана
Deseo Кантучини апельсин в глазури 180 гр,"Снэки, сладости",3 600 Т,Астана
Кантучини Тосканские с Миндалем Deseo 180 гр,"Снэки, сладости",3 600 Т,Астана
Кантучини Фисташки и Шоколад Deseo 180 гр,"Снэки, сладости",3 600 Т,Астана
Картофельные Чипсы Белый Трюфель и Белый Гриб 125 гр,"Снэки, сладости",3 000 Т,Астана
Картофельные чипсы с Морской солью и Бальзамиком ж/б 40 гр,"Снэки, сладости",1 200 Т,Астана
Plaza Del Sol Крутоны с помидорами и орегано 150 гр,"Снэки, сладости",1 200 Т,Астана
Печенье деревенское из цельнозерновой муки Deseo 300 гр,"Снэки, сладости",3 800 Т,Астана
Deseo Печенье песочное на слив. масле классическое 160 гр,"Снэки, сладости",3 600 Т,Астана
Deseo Кантучини шоколад-фундук 250 гр,"Снэки, сладости",3 900 Т,Астана
Deseo Печенье песочное на слив. масле и кусочком темного шоколада 160 гр,"Снэки, сладости",3 600 Т,Астана
Кантучини с Шоколадом и Фундуком Deseo 180 гр,"Снэки, сладости",3 600 Т,Астана
Печенье Biscotti кокосовое Deseo 115 гр,"Снэки, сладости",3 600 Т,Астана
Hunters Gourmet Гороховые чипсы 50 гр,"Снэки, сладости",2 200 Т,Астана
Deseo Печенье песочное на слив. масле перец чили изюм и кедровые орехи 160 гр,"Снэки, сладости",3 600 Т,Астана
Hunters Gourmet Картофельные чипсы Фуа-гра 150 гр,"Снэки, сладости",2 990 Т,Астана
Plaza Del Sol Картофельные чипсы FERIA 130 гр,"Снэки, сладости",1 600 Т,Астана
Plaza Del Sol Картофельные чипсы TAPAS 140 гр,"Снэки, сладости",1 600 Т,Астана
"Джем из Сицилийского лимона, 220 гр","Снэки, сладости",3 500 Т,Астана
Hunters Gourmet Картофельные чипсы Четыре сыра 125 гр,"Снэки, сладости",3 000 Т,Астана
Deseo Печенье песочное на слив. масле с ароматом розы 160 гр,"Снэки, сладости",3 600 Т,Астана
Plaza Del Sol Крутоны с чесноком и петрушкой 150 гр,"Снэки, сладости",1 200 Т,Астана
Печенье Biscotti хрустящее лимонное Deseo 115 гр,"Снэки, сладости",3 600 Т,Астана
Deseo Печенье хрустящее с какао и апельсином 115 гр,"Снэки, сладости",3 600 Т,Астана
Чипсы из Киноа с солью и бальзамиком 75 гр,"Снэки, сладости",1 700 Т,Астана
Plaza Del Sol Крутоны с луком 150 гр,"Снэки, сладости",1 200 Т,Астана
Plaza Del Sol Коктейль Локомикс (смесь орехов и изюма) 175 гр,"Снэки, сладости",1 800 Т,Астана
Bonne Maman Джем клубничный 30 мл,"Снэки, сладости",450 Т,Астана
Печенье деревенское  из Цельнозерновой муки с Какао Deseo 300 гр,"Снэки, сладости",3 800 Т,Астана
Deseo Печенье на оливковом масле с сыром пармезан 80 гр,"Снэки, сладости",2 800 Т,Астана
Топпинг Соус Соленая Карамель Scuyavuru 500 гр,"Снэки, сладости",5 800 Т,Астана
Plaza Del Sol Миндаль очищенный 150 гр,"Снэки, сладости",1 590 Т,Астана
Hunters Gourmet Картофельные чипсы Песто Пармезан 125 гр,"Снэки, сладости",3 000 Т,Астана
Печенье на оливковом масле Какао и Фисташки Deseo 200 гр,"Снэки, сладости",3 800 Т,Астана
Bonne Maman Джем черничный 30 мл,"Снэки, сладости",450 Т,Астана
Deseo Кантучини апельсин 250 гр,"Снэки, сладости",3 900 Т,Астана
Plaza Del Sol Миндаль жареный 150 гр,"Снэки, сладости",1 590 Т,Астана
Bonne Maman Мармелад апельсиновый 30 мл,"Снэки, сладости",450 Т,Астана
Кантучини на оливковом масле с миндалем Deseo 200 гр,"Снэки, сладости",3 600 Т,Астана
Deseo Печенье на оливковом масле с трюфелем 70 гр,"Снэки, сладости",2 800 Т,Астана
Plaza Del Sol Батончик мягкий с миндалем и медом 150 гр,"Снэки, сладости",2 500 Т,Астана
Alicos Конфитюр из Индийского инжира 220 гр,"Снэки, сладости",3 500 Т,Астана
Plaza Del Sol Батончик хрустящий с миндалем и медом 150 гр,"Снэки, сладости",2 500 Т,Астана
Alicos Джем из Сицилийского мандарина 220 гр,"Снэки, сладости",3 500 Т,Астана
Plaza Del Sol Кукурузные орешки 175 гр,"Снэки, сладости",1 200 Т,Астана
Plaza Del Sol Кейк миндально-медовый 150 гр,"Снэки, сладости",2 800 Т,Астана
Deseo Печенье деревенское из муки 300 гр,"Снэки, сладости",3 800 Т,Астана
Джем Вишневый Органический Scuyavuru 250 гр,"Снэки, сладости",2 800 Т,Астана
Мармелад Апельсиновый Scuyavuru 250 гр,"Снэки, сладости",2 800 Т,Астана
Крем Арахисовый соленый Scuyavuru 200 гр,"Снэки, сладости",1 990 Т,Астана
Крем Капучино Scuyavuru 200 гр,"Снэки, сладости",2 800 Т,Астана
Мармелад Лимонный Scuyavuru 250 гр,"Снэки, сладости",2 800 Т,Астана
Alicos Джем из Сицилийского мандарина 110 гр,"Снэки, сладости",2 500 Т,Астана
Deseo Печенье на оливковом масле с томатами и орегано 80 гр,"Снэки, сладости",2 500 Т,Астана
Джем Грушевый Scuyavuru 250 гр,"Снэки, сладости",2 800 Т,Астана
Джем Апельсиновый Органический Scuyavuru 250 гр,"Снэки, сладости",2 800 Т,Астана
Топпинг Сироп Шоколадный Scuyavuru 600 гр,"Снэки, сладости",3 800 Т,Астана
Deseo Печенье на оливковом масле с песто Genovese 80 гр,"Снэки, сладости",2 500 Т,Астана
Джем из Белого Персика Scuyavuru 250 гр,"Снэки, сладости",2 800 Т,Астана
Джем Клубничный Органический Scuyavuru 250 гр,"Снэки, сладости",2 800 Т,Астана
Deseo Кантучини фисташка 180 гр,"Снэки, сладости",3 600 Т,Астана
Джем Клубничный Scuyavuru 250 гр,"Снэки, сладости",2 800 Т,Астана
Джем Черной Смородины Органический Scuyavuru 250 гр,"Снэки, сладости",2 800 Т,Астана
Bonne Maman Паста шоколадная с фундуком 25 гр,"Снэки, сладости",450 Т,Астана
Джем Персиковый Органический Scuyavuru 250 гр,"Снэки, сладости",2 800 Т,Астана
Deseo Кантучини темный шоколад 180 гр,"Снэки, сладости",3 600 Т,Астана
Scuyavuru Джем Абрикосовый Органический 250 гр,"Снэки, сладости",2 800 Т,Астана
Мармелад Мандариновый Scuyavuru 250 гр,"Снэки, сладости",2 800 Т,Астана
Кленовый сироп Uncle Luke 375 мл,"Снэки, сладости",14 200 Т,Астана
Кленовый сироп кленовый лист 250 мл,"Снэки, сладости",16 800 Т,Астана
Кленовый сироп темный 250 мл,"Снэки, сладости",15 800 Т,Астана
Hunters Gourmet Бретцель с Морской солью 180 гр,"Снэки, сладости",2 500 Т,Астана
Hunters Gourmet Киноа белая Органик 300 гр,"Снэки, сладости",3 800 Т,Астана
Hunters Gourmet Мака порошок Органик 150 гр,"Снэки, сладости",2 990 Т,Астана
Hunters Gourmet Семена чиа Органик 300 гр,"Снэки, сладости",4 000 Т,Астана
Джем Абрикосовый Scuyavuru 250 гр,"Снэки, сладости",2 800 Т,Астана
Джем Лимонный Органический Scuyavuru 250 гр,"Снэки, сладости",2 800 Т,Астана
Кленовый сироп Uncle Luke 250 мл,"Снэки, сладости",12 800 Т,Астана
Кленовый сироп 250 мл,"Снэки, сладости",12 800 Т,Астана
Hunters Gourmet Ростки пшеницы порошок (wheat grass) Органик 250гр,"Снэки, сладости",6 800 Т,Астана
Джем Ежевичный Органический Scuyavuru 250 гр,"Снэки, сладости",2 800 Т,Астана
Кленовый сироп Uncle Luke в кувшине 1 л,"Снэки, сладости",22 800 Т,Астана
Кленовый сироп кленовый лист 50 мл,"Снэки, сладости",11 100 Т,Астана
Кленовый сироп кленовый лист 100 мл,"Снэки, сладости",15 800 Т,Астана
Кленовый сироп в кувшине 500 мл,"Снэки, сладости",18 900 Т,Астана
Оливковое Масло Barbera Oro Del Cuoco 1 л,Масло,9 800 Т,Астана
Оливковое Масло Barbera Non Filtrato уп. 1л,Масло,10 800 Т,Астана
Масло Оливковое Barbera Filtrato 1литр,Масло,10 800 Т,Астана
Масло Оливковое BARBERA Selezione Unica 750 мл.,Масло,8 800 Т,Астана
"Оливковое Масло Lorenzo #5, бутылка 500 мл",Масло,12 800 Т,Астана
Оливковое Масло Barbera Selezione Unica 1 литр,Масло,9 800 Т,Астана
"Оливковое Масло Lorenzo #1, бутылка 500 мл",Масло,12 800 Т,Астана
"Оливковое Масло Lorenzo #3, бутылка 500 мл",Масло,12 800 Т,Астана
Barbera Масло оливковое с белым трюфелем 250 мл,Масло,4 800 Т,Астана
Barbera Масло оливковое Mediterraneo extra virgin 1000 мл,Масло,9 800 Т,Астана
Barbera Масло оливковое Mediterraneo extra virgin 750 мл,Масло,6 990 Т,Астана
Barbera Масло оливковое с цитрусами Сицилии 250 мл,Масло,4 800 Т,Астана
Оливковое масло Harmony Hualdo ж/б 3 л,Масло,32 000 Т,Астана
Barbera Масло оливковое NON FILTRATO (нефильтр) 750 мл,Масло,8 800 Т,Астана
Barbera Масло оливковое с черным трюфелем 250 мл,Масло,4 800 Т,Астана
Масло оливковое OLIA Barbera 500 мл,Масло,11 500 Т,Астана
Оливковое масло Sensation Hualdo ж/б 3 л,Масло,32 000 Т,Астана
Barbera Масло оливковое FILTRATO (фильтрованное) 750 мл,Масло,8 800 Т,Астана
Barbera Масло оливковое с ароматическими травами 250 мл,Масло,4 800 Т,Астана
Barbera Масло оливковое CONTADINO 1л,Масло,13 500 Т,Астана
Масло оливковое Frantoia со вкусом базилика 250 мл,Масло,4 800 Т,Астана
Оливковое масло Hualdo Cornicabra 500 мл,Масло,6 800 Т,Астана
Оливковое масло Hualdo Arbequina 500 ml,Масло,6 800 Т,Астана
Оливковое масло Hualdo Manzanilla 500 ml,Масло,6 800 Т,Астана
Barbera Масло оливковое CONTADINO 500 мл,Масло,8 500 Т,Астана
Масло оливковое Frantoia со вкусом мандарина 250 мл,Масло,4 800 Т,Астана
Масло оливковое Frantoia со вкусом апельсина 250 мл,Масло,4 800 Т,Астана
Barbera Масло оливковое с перцем и чесноком 250 мл,Масло,4 800 Т,Астана
Оливковое Масло BARBERA Selezione Unica 250 мл,Масло,4 800 Т,Астана
"Оливковое Масло Casitas De Hualdo, 250 мл",Масло,4 800 Т,Астана
Масло оливковое Frantoia со вкусом лимона 250 мл,Масло,4 800 Т,Астана
Оливковое масло Hualdo Picual 500 ml,Масло,7 800 Т,Астана
Масло оливковое PARTIDA REAL(партида реал) Hualdo  500 мл,Масло,6 800 Т,Астана
"Кокосовое Масло Aroy-D, 180 мл",Масло,2 700 Т,Астана
Масло оливковое Frantoia со вкусом Шалфея 250 мл,Масло,4 800 Т,Астана
Оливковое Масло Hualdo Cornicabra 250 мл,Масло,4 800 Т,Астана
Оливковое Масло Hualdo Picual 250 мл,Масло,4 800 Т,Астана
Оливковое масло Hualdo Arbequina 250 мл,Масло,4 800 Т,Астана
Muraglia Масло оливковое в керам/б Осьминог 500 мл,Масло,17 800 Т,Астана
Оливковое Масло Hualdo Manzanilla 250 мл,Масло,4 800 Т,Астана
Muraglia Масло оливковое в керам/б Омар 500 мл,Масло,17 800 Т,Астана
Muraglia Масло оливковое в ж/б Радужная 250 мл,Масло,4 500 Т,Астана
Muraglia Масло оливковое в керам/б Кактус  500 мл,Масло,17 800 Т,Астана
Muraglia Масло оливковое в керам/б Радужная 500 мл,Масло,17 800 Т,Астана
Muraglia Масло оливковое Сардины в керам/б 500 мл,Масло,17 800 Т,Астана
Barbera Масло оливковое FILTRATO (фильтрованное) 750 мл KF,Масло,9 500 Т,Астана
Barbera Масло оливковое NON FILTRATO (нефильтр) 750 мл KF,Масло,8 800 Т,Астана
Сыр творожный «Профичиз» 200 гр,Сыры,1 500 Т,Астана
Vega Mancha Сыр Манчего выдержанный с белым трюфелем кусковой 150 гр +/-,Сыры,30 000 Т,Астана
Сыр Манчего 2-3 месяца Vega Mancha кусковой ±150 гр,Сыры,29 800 Т,Астана
Vega Mancha  Semicurado Сыр Манчего 2-3 месяца кусковой 150 гр,Сыры,29 800 Т,Астана
"Ghidetti Сыр Parmigiano Dop 18 мес, кусковой",Сыры,22 000 Т,Астана
Vega Mancha Сыр Манчего выдержанный Diablo кусковой 200 гр,Сыры,29 800 Т,Астана
"Luigi Guffanti Буонасорте сыр твердый,24 месяца кусковой ±300 гр",Сыры,24 500 Т,Астана
Vega Mancha Сыр Манчего выдержанный с белыми грибами кусковой 200 гр,Сыры,29 800 Т,Астана
Сыр творожный Cremette 200 гр,Сыры,1 000 Т,Астана
"Ghidetti Сыр Grana Padano Dop 10-12 мес, кусковой",Сыры,25 000 Т,Астана
Ghidetti Сыр Рикотта 295 гр,Сыры,2 800 Т,Астана
Ghidetti Сыр Проволоне с орегано 200 гр,Сыры,3 800 Т,Астана
"Ghidetti Сыр Маскарпоне 42%, 250 гр",Сыры,3 000 Т,Астана
Ghidetti Сыр Проволоне Валпадана Дольче 200 гр,Сыры,3 800 Т,Астана
Сыр творожный Профичиз 70% Хорека 2 кг,Сыры,8 800 Т,Астана
"Vega Mancha Сыр Манчего выдержанный с белым трюфелем круг 3,4 кг +/-",Сыры,24 990 Т,Астана
"Luigi Guffanti Буонасорте сыр твердый на буйволином молоке, 24 месяца кусковой ±300 гр",Сыры,35 500 Т,Астана
Ghidetti Сыр Проволоне Дольче 200 гр,Сыры,3 800 Т,Астана
Ghidetti Сыр Проволоне Валпадана Пикантный 200 гр,Сыры,3 800 Т,Астана
"Luigi Guffanti Горгонзола Дольче сыр мягкий, кусковой 250-300 гр.",Сыры,23 500 Т,Астана
"Luigi Guffanti Пьяве Веччо сыр полутвердый, кусковой 250-300 гр",Сыры,28 500 Т,Астана
"Luigi Guffanti Пьяве Меззано сыр полутвердый, кусковой 250-300 гр",Сыры,26 800 Т,Астана
"Luigi Guffanti Пьяве Оро сыр полутвердый, кусковой 250-300 гр",Сыры,29 900 Т,Астана
"Ghidetti Сыр Grana Padano Dop 10-12 мес, 1 кг",Сыры,17 500 Т,Астана
"Сыр Манчего полувыдержанный 2-3 месяца Vega Mancha круг 3,4 кг",Сыры,25 990 Т,Астана
Ghidetti Сыр твердый Gran Guardia 1 кг,Сыры,14 500 Т,Астана
"Luigi Guffanti Пьяве Веччо сыр полутвердый, круг 6.5 кг",Сыры,27 500 Т,Астана
"Luigi Guffanti Пьяве Оро сыр полутвердый, круг 6.5 кг",Сыры,28 900 Т,Астана
